{
  "module": "WHATSAPP",
  "schema_version": "1.0.0",
  "generated_at": "2026-09-06T15:56:26.240Z",
  "harvester_version": "1.0.0",
  "test_cases": [
    {
      "id": "TC-PLATFORM-063",
      "title": "Send without bearer token returns unauthorized",
      "module": "WHATSAPP",
      "type": "security",
      "type_evidence": "asserts an authentication or authorization outcome",
      "category": "Integration",
      "category_evidence": "IntegrationTests project",
      "module_evidence": "subject-components",
      "subject_component": null,
      "obsolete_review": null,
      "priority": "unset",
      "preconditions": [],
      "test_data": null,
      "steps": [],
      "expected_result": null,
      "automation": "AUTOMATED",
      "automation_ref": "tests/IntegrationTests/WhatsApp/WhatsAppMessagesEndpointsTests.cs::WhatsAppMessagesEndpointsTests.Send_WithoutBearerToken_ReturnsUnauthorized",
      "assertions": [
        "HttpStatusCode.Unauthorized"
      ],
      "requirements": [],
      "features": [],
      "components": [],
      "test_plans": [],
      "last_result": null,
      "machine": {
        "file": "tests/IntegrationTests/WhatsApp/WhatsAppMessagesEndpointsTests.cs",
        "project": "IntegrationTests",
        "framework": "xunit",
        "namespace": "MathilensERP.IntegrationTests.WhatsApp",
        "class": "WhatsAppMessagesEndpointsTests",
        "method": "Send_WithoutBearerToken_ReturnsUnauthorized",
        "attribute": "Fact",
        "attributes": [
          "Fact"
        ],
        "signature": "public async Task Send_WithoutBearerToken_ReturnsUnauthorized()",
        "is_async": true,
        "line": 18,
        "body_lines": 7,
        "inline_data": [],
        "member_data": [],
        "fixtures": [
          "CustomWebApplicationFactory"
        ],
        "usings": [],
        "http_calls": [
          {
            "path": "/api/v1/whatsapp-messages",
            "normalized": "/api/v1/whatsapp-messages",
            "verb": "POST",
            "route_component": "COMP-PLATFORM-071"
          }
        ],
        "exercises": [
          {
            "component": "COMP-PLATFORM-071",
            "name": "WhatsAppMessagesController",
            "via": "http-route",
            "confidence": "CONFIRMED"
          }
        ],
        "unresolved_references": [
          "Assert",
          "AuthenticationHeaderValue",
          "CustomWebApplicationFactory",
          "Guid",
          "HttpClient",
          "TestAuthentication"
        ],
        "git": {
          "state": "COMMITTED",
          "last_commit": "84330f500134fc1d28946b7c4dbc5aa847b9f899",
          "last_commit_date": "2026-08-05",
          "last_commit_subject": "Add WhatsApp backend (Phase 3, module 2 of 4)",
          "commit_count": 1
        }
      },
      "status": "active",
      "data_classification": "PUBLIC_SAFE",
      "provenance": {
        "generator": "harvest-tests.mjs",
        "generator_version": "1.0.0",
        "generated_at": "2026-09-06T15:56:26.240Z",
        "confidence": "CONFIRMED",
        "evidence": [
          {
            "kind": "test-method",
            "ref": "tests/IntegrationTests/WhatsApp/WhatsAppMessagesEndpointsTests.cs::Send_WithoutBearerToken_ReturnsUnauthorized",
            "line": 18
          },
          {
            "kind": "route",
            "ref": "/api/v1/whatsapp-messages",
            "detail": "tests/IntegrationTests/WhatsApp/WhatsAppMessagesEndpointsTests.cs",
            "line": 18
          }
        ]
      },
      "last_verified_commit": "84330f500134fc1d28946b7c4dbc5aa847b9f899",
      "change_history": [],
      "entity_version": 1
    },
    {
      "id": "TC-PLATFORM-064",
      "title": "Send with blank content returns validation error envelope",
      "module": "WHATSAPP",
      "type": "validation",
      "type_evidence": "asserts a validation outcome",
      "category": "Integration",
      "category_evidence": "IntegrationTests project",
      "module_evidence": "subject-components",
      "subject_component": null,
      "obsolete_review": null,
      "priority": "unset",
      "preconditions": [],
      "test_data": null,
      "steps": [],
      "expected_result": null,
      "automation": "AUTOMATED",
      "automation_ref": "tests/IntegrationTests/WhatsApp/WhatsAppMessagesEndpointsTests.cs::WhatsAppMessagesEndpointsTests.Send_WithBlankContent_ReturnsValidationErrorEnvelope",
      "assertions": [
        "HttpStatusCode.BadRequest",
        "\"VALIDATION_ERROR\""
      ],
      "requirements": [],
      "features": [],
      "components": [],
      "test_plans": [],
      "last_result": null,
      "machine": {
        "file": "tests/IntegrationTests/WhatsApp/WhatsAppMessagesEndpointsTests.cs",
        "project": "IntegrationTests",
        "framework": "xunit",
        "namespace": "MathilensERP.IntegrationTests.WhatsApp",
        "class": "WhatsAppMessagesEndpointsTests",
        "method": "Send_WithBlankContent_ReturnsValidationErrorEnvelope",
        "attribute": "Fact",
        "attributes": [
          "Fact"
        ],
        "signature": "public async Task Send_WithBlankContent_ReturnsValidationErrorEnvelope()",
        "is_async": true,
        "line": 27,
        "body_lines": 11,
        "inline_data": [],
        "member_data": [],
        "fixtures": [
          "CustomWebApplicationFactory"
        ],
        "usings": [],
        "http_calls": [
          {
            "path": "/api/v1/whatsapp-messages",
            "normalized": "/api/v1/whatsapp-messages",
            "verb": "POST",
            "route_component": "COMP-PLATFORM-071"
          }
        ],
        "exercises": [
          {
            "component": "COMP-PLATFORM-071",
            "name": "WhatsAppMessagesController",
            "via": "http-route",
            "confidence": "CONFIRMED"
          }
        ],
        "unresolved_references": [
          "Assert",
          "AuthenticationHeaderValue",
          "Content",
          "CustomWebApplicationFactory",
          "Guid",
          "HttpClient",
          "JsonElement",
          "TestAuthentication"
        ],
        "git": {
          "state": "COMMITTED",
          "last_commit": "84330f500134fc1d28946b7c4dbc5aa847b9f899",
          "last_commit_date": "2026-08-05",
          "last_commit_subject": "Add WhatsApp backend (Phase 3, module 2 of 4)",
          "commit_count": 1
        }
      },
      "status": "active",
      "data_classification": "PUBLIC_SAFE",
      "provenance": {
        "generator": "harvest-tests.mjs",
        "generator_version": "1.0.0",
        "generated_at": "2026-09-06T15:56:26.240Z",
        "confidence": "CONFIRMED",
        "evidence": [
          {
            "kind": "test-method",
            "ref": "tests/IntegrationTests/WhatsApp/WhatsAppMessagesEndpointsTests.cs::Send_WithBlankContent_ReturnsValidationErrorEnvelope",
            "line": 27
          },
          {
            "kind": "route",
            "ref": "/api/v1/whatsapp-messages",
            "detail": "tests/IntegrationTests/WhatsApp/WhatsAppMessagesEndpointsTests.cs",
            "line": 27
          }
        ]
      },
      "last_verified_commit": "84330f500134fc1d28946b7c4dbc5aa847b9f899",
      "change_history": [],
      "entity_version": 1
    },
    {
      "id": "TC-PLATFORM-065",
      "title": "Send with empty customer ID returns validation error envelope",
      "module": "WHATSAPP",
      "type": "validation",
      "type_evidence": "asserts a validation outcome",
      "category": "Integration",
      "category_evidence": "IntegrationTests project",
      "module_evidence": "subject-components",
      "subject_component": null,
      "obsolete_review": null,
      "priority": "unset",
      "preconditions": [],
      "test_data": null,
      "steps": [],
      "expected_result": null,
      "automation": "AUTOMATED",
      "automation_ref": "tests/IntegrationTests/WhatsApp/WhatsAppMessagesEndpointsTests.cs::WhatsAppMessagesEndpointsTests.Send_WithEmptyCustomerId_ReturnsValidationErrorEnvelope",
      "assertions": [
        "HttpStatusCode.BadRequest",
        "\"VALIDATION_ERROR\""
      ],
      "requirements": [],
      "features": [],
      "components": [],
      "test_plans": [],
      "last_result": null,
      "machine": {
        "file": "tests/IntegrationTests/WhatsApp/WhatsAppMessagesEndpointsTests.cs",
        "project": "IntegrationTests",
        "framework": "xunit",
        "namespace": "MathilensERP.IntegrationTests.WhatsApp",
        "class": "WhatsAppMessagesEndpointsTests",
        "method": "Send_WithEmptyCustomerId_ReturnsValidationErrorEnvelope",
        "attribute": "Fact",
        "attributes": [
          "Fact"
        ],
        "signature": "public async Task Send_WithEmptyCustomerId_ReturnsValidationErrorEnvelope()",
        "is_async": true,
        "line": 40,
        "body_lines": 11,
        "inline_data": [],
        "member_data": [],
        "fixtures": [
          "CustomWebApplicationFactory"
        ],
        "usings": [],
        "http_calls": [
          {
            "path": "/api/v1/whatsapp-messages",
            "normalized": "/api/v1/whatsapp-messages",
            "verb": "POST",
            "route_component": "COMP-PLATFORM-071"
          }
        ],
        "exercises": [
          {
            "component": "COMP-PLATFORM-071",
            "name": "WhatsAppMessagesController",
            "via": "http-route",
            "confidence": "CONFIRMED"
          }
        ],
        "unresolved_references": [
          "Assert",
          "AuthenticationHeaderValue",
          "Content",
          "CustomWebApplicationFactory",
          "HttpClient",
          "JsonElement",
          "TestAuthentication"
        ],
        "git": {
          "state": "COMMITTED",
          "last_commit": "84330f500134fc1d28946b7c4dbc5aa847b9f899",
          "last_commit_date": "2026-08-05",